title,url
"‘Not built right the first time’ — Musk’s xAI is starting over again, again",https://techcrunch.com/2026/03/13/not-built-right-the-first-time-musks-xai-is-starting-over-again-again/
Lawyer behind AI psychosis cases warns of mass casualty risks,https://techcrunch.com/2026/03/13/lawyer-behind-ai-psychosis-cases-warns-of-mass-casualty-risks/
"Nyne, founded by a father-son duo, gives AI agents the human context they’re missing",https://techcrunch.com/2026/03/13/nyne-founded-by-a-father-son-duo-gives-ai-agents-the-human-context-theyre-missing/
Steven Spielberg says he’s ‘never used AI’ in any of his films,https://techcrunch.com/2026/03/13/steven-spielberg-says-hes-never-used-ai-in-any-of-his-films/
The biggest AI stories of the year (so far),https://techcrunch.com/2026/03/13/the-biggest-ai-stories-of-the-year-so-far/
"Peacock expands into AI-driven video, mobile-first live sports, and gaming",https://techcrunch.com/2026/03/13/peacock-expands-into-ai-driven-video-mobile-first-live-sports-and-gaming/
"Sales automation startup Rox AI hits $1.2B valuation, sources say",https://techcrunch.com/2026/03/12/sales-automation-startup-rox-ai-hits-1-2b-valuation-sources-say/
Facebook Marketplace now lets Meta AI respond to buyers’ messages,https://techcrunch.com/2026/03/12/facebook-marketplace-now-lets-meta-ai-respond-to-buyers-messages/
Atlassian follows Block’s footsteps and cuts staff in the name of AI,https://techcrunch.com/2026/03/12/atlassian-follows-blocks-footsteps-and-cuts-staff-in-the-name-of-ai/
"Bumble introduces an AI dating assistant, ‘Bee’",https://techcrunch.com/2026/03/12/bumble-introduces-an-ai-dating-assistant-bee/
A writer is suing Grammarly for turning her and other authors into ‘AI editors’ without consent,https://techcrunch.com/2026/03/12/a-writer-is-suing-grammarly-for-turning-her-and-other-authors-into-ai-editors-without-consent/
Gumloop lands $50M from Benchmark to turn every employee into an AI agent builder,https://techcrunch.com/2026/03/12/gumloop-lands-50m-from-benchmark-to-turn-every-employee-into-an-ai-agent-builder/
Wonderful raises $150M Series B at $2B valuation,https://techcrunch.com/2026/03/12/wonderful-raises-150m-series-b-at-2b-valuation/
Google is using old news reports and AI to predict flash floods,https://techcrunch.com/2026/03/12/google-is-using-old-news-reports-and-ai-to-predict-flash-floods/
Google Maps is getting an AI ‘Ask Maps’ feature and upgraded ‘immersive’ navigation,https://techcrunch.com/2026/03/12/google-maps-is-getting-an-ai-ask-maps-feature-and-upgraded-immersive-navigation/
AI ‘actor’ Tilly Norwood put out the worst song I’ve ever heard,https://techcrunch.com/2026/03/11/ai-actor-tilly-norwood-put-out-the-worst-song-ive-ever-heard/
Ford’s new AI assistant will help fleet owners know if seatbelts are being used,https://techcrunch.com/2026/03/11/fords-new-ai-assistant-will-help-fleet-owners-know-if-seatbelts-are-being-used/
Netflix may have paid $600 million for Ben Affleck’s AI startup,https://techcrunch.com/2026/03/11/netflix-may-have-paid-600-million-for-ben-afflecks-ai-startup/
"Meta acquired Moltbook, the AI agent social network that went viral because of fake posts",https://techcrunch.com/2026/03/10/meta-acquired-moltbook-the-ai-agent-social-network-that-went-viral-because-of-fake-posts/
Yann LeCun’s AMI Labs raises $1.03B to build world models,https://techcrunch.com/2026/03/09/yann-lecuns-ami-labs-raises-1-03-billion-to-build-world-models/
Anthropic launches code review tool to check flood of AI-generated code,https://techcrunch.com/2026/03/09/anthropic-launches-code-review-tool-to-check-flood-of-ai-generated-code/
"A roadmap for AI, if anyone will listen",https://techcrunch.com/2026/03/07/a-roadmap-for-ai-if-anyone-will-listen/
1M context is now generally available for Opus 4.6 and Sonnet 4.6,https://claude.com/blog/1m-context-ga
"AI Gets Wrong Woman Jailed for Six Months, Life Ruined",https://www.youtube.com/watch?v=mzS7dmCUzcQ
Show HN: GitAgent – An open standard that turns any Git repo into an AI agent,https://www.gitagent.sh/
Digg is gone again,https://digg.com/
Can I run AI locally?,https://www.canirun.ai/
Show HN: Ink – Deploy full-stack apps from AI agents via MCP or Skills,https://ml.ink/
Qatar helium shutdown puts chip supply chain on a two-week clock,https://www.tomshardware.com/tech-industry/qatar-helium-shutdown-puts-chip-supply-chain-on-a-two-week-clock
New 'negative light' technology hides data transfers in plain sight,https://www.unsw.edu.au/newsroom/news/2026/03/New-negative-light-technology-hides-data-transfers-in-plain-sight
Elon Musk pushes out more xAI founders as AI coding effort falters,https://www.ft.com/content/e5fbc6c2-d5a6-4b97-a105-6a96ea849de5
Launch HN: Spine Swarm (YC S23) – AI agents that collaborate on a visual canvas,https://www.getspine.ai/
Temperatures expected to remain at or near record levels in coming five years,https://www.metoffice.gov.uk/about-us/news-and-media/media-centre/weather-and-climate-news/2025/global-temperatures-expected-to-remain-at-or-near-record-levels
Emacs and Vim in the Age of AI,https://batsov.com/articles/2026/03/09/emacs-and-vim-in-the-age-of-ai/
The Wyden Siren Goes Off Again: We’ll Be “Stunned” By What the NSA Is Doing,https://www.techdirt.com/2026/03/12/the-wyden-siren-goes-off-again-well-be-stunned-by-what-the-nsa-is-doing-under-section-702/
Launch HN: Captain (YC W26) – Automated RAG for Files,https://www.runcaptain.com/
John Carmack about open source and anti-AI activists,https://twitter.com/id_aa_carmack/status/2032460578669691171
Artificial intelligence-associated delusions and large language models,https://www.thelancet.com/journals/lanpsy/article/PIIS2215-0366(25)00396-7/abstract
AI didn't simplify software engineering: It just made bad engineering easier,https://robenglander.com/writing/ai-did-not-simplify/
Grief and the AI split,https://blog.lmorchard.com/2026/03/11/grief-and-the-ai-split/
Iran-backed hackers claim wiper attack on medtech firm Stryker,https://krebsonsecurity.com/2026/03/iran-backed-hackers-claim-wiper-attack-on-medtech-firm-stryker/
What changes happen in the aging brain?,https://www.salk.edu/news-release/what-changes-happen-in-the-aging-brain/
Show HN: Axe – A 12MB binary that replaces your AI framework,https://github.com/jrswab/axe
