title,url
Anthropic took down thousands of GitHub repos trying to yank its leaked source code — a move the company says was an accident,https://techcrunch.com/2026/04/01/anthropic-took-down-thousands-of-github-repos-trying-to-yank-its-leaked-source-code-a-move-the-company-says-was-an-accident/
Meta’s natural gas binge could power South Dakota,https://techcrunch.com/2026/04/01/metas-natural-gas-binge-could-power-south-dakota/
"Cognichip wants AI to design the chips that power AI, and just raised $60M to try",https://techcrunch.com/2026/04/01/cognichip-wants-ai-to-design-the-chips-that-power-ai-and-just-raised-60m-to-try/
"Less than a month: StrictlyVC San Francisco brings leaders from TDK Ventures, Replit, and more together",https://techcrunch.com/2026/04/01/join-the-first-strictlyvc-of-2026-in-sf-with-leaders-from-tdk-ventures-and-replits-co-founder/
Mercor says it was hit by cyberattack tied to compromise of open source LiteLLM project,https://techcrunch.com/2026/03/31/mercor-says-it-was-hit-by-cyberattack-tied-to-compromise-of-open-source-litellm-project/
Anthropic is having a month,https://techcrunch.com/2026/03/31/anthropic-is-having-a-month/
"Salesforce announces an AI-heavy makeover for Slack, with 30 new features",https://techcrunch.com/2026/03/31/salesforce-announces-an-ai-heavy-makeover-for-slack-with-30-new-features/
"OpenAI, not yet public, raises $3B from retail investors in monster $122B fund raise",https://techcrunch.com/2026/03/31/openai-not-yet-public-raises-3b-from-retail-investors-in-monster-122b-fund-raise/
Yupp shuts down after raising $33M from a16z crypto’s Chris Dixon,https://techcrunch.com/2026/03/31/yupp-ai-shuts-down-33m-a16z-crypto-chris-dixon/
Alexa+ gets new food ordering experiences with Uber Eats and Grubhub,https://techcrunch.com/2026/03/31/alexa-plus-new-food-ordering-experiences-with-uber-eats-and-grubhub/
Nomadic raises $8.4 million to wrangle the data pouring off autonomous vehicles,https://techcrunch.com/2026/03/31/nomadic-raises-8-4-million-to-wrangle-the-data-pouring-off-avs/
"Exclusive: Runway launches $10M fund, Builders program to support early-stage AI startups",https://techcrunch.com/2026/03/31/exclusive-runway-launches-10m-fund-builders-program-to-support-early-stage-ai-startups/
"With its new app store, Ring bets on AI to go beyond home security",https://techcrunch.com/2026/03/31/ring-app-store-bets-on-ai-to-go-beyond-home-security/
"15% of Americans say they’d be willing to work for an AI boss, according to new poll",https://techcrunch.com/2026/03/30/ai-work-boss-supervisor-us-quinnipiac-poll/
Popular AI gateway startup LiteLLM ditches controversial startup Delve,https://techcrunch.com/2026/03/30/popular-ai-gateway-startup-litellm-ditches-controversial-startup-delve/
"As more Americans adopt AI tools, fewer say they can trust the results",https://techcrunch.com/2026/03/30/ai-trust-adoption-poll-more-americans-adopt-tools-fewer-say-they-can-trust-the-results/
Mantis Biotech is making ‘digital twins’ of humans to help solve medicine’s data availability problem,https://techcrunch.com/2026/03/30/mantis-biotech-is-making-digital-twins-of-humans-to-help-solve-medicines-data-availability-problem/
ScaleOps raises $130M to improve computing efficiency amid AI demand,https://techcrunch.com/2026/03/30/scaleops-130m-series-c-kubernetes-efficiency-ai-demand-funding/
AI chip startup Rebellions raises $400 million at $2.3B valuation in pre-IPO round,https://techcrunch.com/2026/03/30/ai-chip-startup-rebellions-raises-400-million-at-2-3b-valuation-in-pre-ipo-round/
Mistral AI raises $830M in debt to set up a data center near Paris,https://techcrunch.com/2026/03/30/mistral-ai-raises-830m-in-debt-to-set-up-a-data-center-near-paris/
Qodo raises $70M for code verification as AI coding scales,https://techcrunch.com/2026/03/30/qodo-bets-on-code-verification-as-ai-coding-scales-raises-70m/
Starcloud raises $170 million Series A to build data centers in space,https://techcrunch.com/2026/03/30/starcloud-raises-170-million-series-ato-build-data-centers-in-space/
Why OpenAI really shut down Sora,https://techcrunch.com/2026/03/29/why-openai-really-shut-down-sora/
Sora’s shutdown could be a reality check moment for AI video,https://techcrunch.com/2026/03/29/soras-shutdown-could-be-a-reality-check-moment-for-ai-video/
"Bluesky leans into AI with Attie, an app for building custom feeds",https://techcrunch.com/2026/03/28/bluesky-leans-into-ai-with-attie-an-app-for-building-custom-feeds/
Stanford study outlines dangers of asking AI chatbots for personal advice,https://techcrunch.com/2026/03/28/stanford-study-outlines-dangers-of-asking-ai-chatbots-for-personal-advice/
Elon Musk’s last co-founder reportedly leaves xAI,https://techcrunch.com/2026/03/28/elon-musks-last-co-founder-reportedly-leaves-xai/
Anthropic’s Claude popularity with paying consumers is skyrocketing,https://techcrunch.com/2026/03/28/anthropics-claude-popularity-with-paying-consumers-is-skyrocketing/
Why SoftBank’s new $40B loan points to a 2026 OpenAI IPO,https://techcrunch.com/2026/03/27/why-softbanks-new-40b-loan-points-to-a-2026-openai-ipo/
Memory chip giant SK hynix could help end ‘RAMmageddon’ with blockbuster US IPO,https://techcrunch.com/2026/03/27/memory-chip-giant-sk-hynix-could-help-end-rammageddon-with-blockbuster-us-ipo/
Google is now letting users in the US change their Gmail address,https://techcrunch.com/2026/03/31/google-is-now-letting-users-in-the-us-change-their-gmail-address/
"The Pixel 10a doesn’t have a camera bump, and it’s great",https://techcrunch.com/2026/03/29/google-pixel-10a-review-camera-bump-performance-ai-chip/
Let’s take a look at the retro tech making a comeback,https://techcrunch.com/2026/03/28/lets-take-a-look-at-the-retro-tech-making-a-comeback/
Waymo’s skyrocketing ridership in one chart,https://techcrunch.com/2026/03/27/waymo-skyrocketing-ridership-in-one-chart/
Blue Origin,https://techcrunch.com/2026/03/20/jeff-bezos-blue-origin-enters-the-space-data-center-game/
Tech Layoffs,https://techcrunch.com/2025/02/28/tech-layoffs-2024-list/
Subscription bombing and how to mitigate it,https://bytemash.net/posts/subscription-bombing-your-signup-form-is-a-weapon/
Live: Artemis II Launch Day Updates,https://www.nasa.gov/blogs/missions/2026/04/01/live-artemis-ii-launch-day-updates/
The Claude Code Leak,https://build.ms/2026/4/1/the-claude-code-leak/
Quantum computing bombshells that are not April Fools,https://scottaaronson.blog/?p=9665
Steam on Linux Use Skyrocketed Above 5% in March,https://www.phoronix.com/news/Steam-On-Linux-Tops-5p
r/programming bans all discussion of LLM programming,https://old.reddit.com/r/programming/comments/1s9jkzi/announcement_temporary_llm_content_ban/
Email obfuscation: What works in 2026?,https://spencermortensen.com/articles/email-obfuscation/
A new C++ back end for ocamlc,https://github.com/ocaml/ocaml/pull/14701
EmDash – A spiritual successor to WordPress that solves plugin security,https://blog.cloudflare.com/emdash-wordpress/
DRAM pricing is killing the hobbyist SBC market,https://www.jeffgeerling.com/blog/2026/dram-pricing-is-killing-the-hobbyist-sbc-market/
Fast and Gorgeous Erosion Filter,https://blog.runevision.com/2026/03/fast-and-gorgeous-erosion-filter.html
Show HN: Git bayesect – Bayesian Git bisection for non-deterministic bugs,https://github.com/hauntsaninja/git_bayesect
What Gödel Discovered (2020),https://stopa.io/post/269
AI for American-produced cement and concrete,https://engineering.fb.com/2026/03/30/data-center-engineering/ai-for-american-produced-cement-and-concrete/
Mercor says it was hit by cyberattack tied to compromise LiteLLM,https://techcrunch.com/2026/03/31/mercor-says-it-was-hit-by-cyberattack-tied-to-compromise-of-open-source-litellm-project/
AI Perfected Chess. Humans Made It Unpredictable Again,https://www.bloomberg.com/news/articles/2026-03-27/ai-changed-chess-grandmasters-now-win-with-unpredictable-moves
The future of code search is not regex – 100x faster than ripgrep,https://fff.dmtrkovalenko.dev/
Show HN: NASA Artemis II Mission Timeline Tracker,https://www.sunnywingsvirtual.com/artemis2/timeline.html
"Reverse Engineering Crazy Taxi, Part 2",https://wretched.computer/post/crazytaxi2
Signing data structures the wrong way,https://blog.foks.pub/posts/domain-separation-in-idl/
"Show HN: Dull – Instagram Without Reels, YouTube Without Shorts (iOS)",https://getdull.app
The Windows equivalents of the most used Linux commands,http://techkettle.blogspot.com/2026/04/the-windows-equivalents-of-most-used.html
InspectMind AI (YC W24) Is Hiring,https://www.ycombinator.com/companies/inspectmind-ai/jobs/jQNra64-software-engineer-build-the-world-s-best-ai-plan-checker
The revenge of the data scientist,https://hamel.dev/blog/posts/revenge/
Trinity Large Thinking,https://openrouter.ai/arcee-ai/trinity-large-thinking
"IPv6 address, as a sentence you can remember",https://sentence2ipv6.tib3rius.com/
SpaceX files to go public,https://www.nytimes.com/2026/04/01/technology/spacex-ipo-elon-musk.html
Set the Line Before It's Crossed,https://nomagicpill.substack.com/p/set-the-line-before-its-crossed
Weather.com/Retro,https://weather.com/retro/
StepFun 3.5 Flash is #1 cost-effective model for OpenClaw tasks (300 battles),https://app.uniclaw.ai/arena?tab=costEffectiveness&via=hn
Jax's true calling: Ray-Marching renderers on WebGL,https://benoit.paris/posts/jax-ray-marcher/
SolveSpace (open source 2D/3D CAD) working on Windows 2000 (2025),https://github.com/solvespace/solvespace/issues/1036
Ariane 6 user's manual [pdf],https://www.ariane.group/app/uploads/sites/4/2024/10/Mua-6_Issue-2_Revision-0_March-2021.pdf
Scientists crack a 20-year nuclear mystery behind the creation of gold,https://www.sciencedaily.com/releases/2026/03/260313002633.htm
"Salomi, a research repo on extreme low-bit transformer quantization",https://github.com/OrionsLock/SALOMI
BurgerDisk News,https://www.colino.net/wordpress/archives/2026/03/28/burgerdisk-news/
Show HN: Flight-Viz – 10K flights on a 3D globe in 3.5MB of Rust+WASM,https://flight-viz.com
Solar Balconies Take Europe by Storm,https://hackaday.com/2026/03/31/solar-balconies-take-europe-by-storm/
"Show HN: Semantic atlas of 188 constitutions in 3D (30k articles, embeddings)",https://constitutionalmap.ai/en
Escaping the Ogallala Trap,https://worksinprogress.co/issue/escaping-the-ogallala-trap/
Intuiting Pratt Parsing,https://louis.co.nz/2026/03/26/pratt-parsing.html
Windows 95 defenses against installers that overwrite a file with an older one,https://devblogs.microsoft.com/oldnewthing/20260324-00/?p=112159
Tracing goroutines in realtime with eBPF,https://sazak.io/articles/tracing-goroutines-in-realtime-with-ebpf-2026-03-31
"Random numbers, Persian code: A mysterious signal transfixes radio sleuths",https://www.rferl.org/a/mystery-numbers-station-persian-signal-iran-war/33700659.html
How-to guide: Commissioning a Sensor Physics R&D Lab,https://gist.github.com/nup002/912383615b12dc1ec44ae9004c40b11f
"ZomboCom stolen by a hacker, sold, now replaced with AI-generated makeover",https://old.reddit.com/r/oldinternet/comments/1raiz8v/zombocom_was_stolen_by_hacker_put_up_for_sale_and/
Show HN: CLI to order groceries via reverse-engineered REWE API (Haskell),https://github.com/yannick-cw/korb
Swappa.com for GrapheneOS compatible devices – Stay Away,https://discuss.grapheneos.org/d/33727-swappacom-for-grapheneos-compatible-devices-stay-away
Ada and Spark on ARM Cortex-M – A Tutorial with Arduino and Nucleo Examples,http://inspirel.com/articles/Ada_On_Cortex.html
Is BGP safe yet?,https://isbgpsafeyet.com/
"Show HN: Zerobox – Sandbox any command with file, network, credential controls",https://github.com/afshinm/zerobox
Show HN: We open-sourced our content writing workflow as a Claude Code skill,https://www.npmjs.com/package/claude-content-writer
Consider the Greenland Shark (2020),https://www.lrb.co.uk/the-paper/v42/n09/katherine-rundell/consider-the-greenland-shark
Refine: AI-Powered Peer Review,https://www.refine.ink/
Apple removes iPhone vibe coding app from app store,https://gizmodo.com/apple-removes-iphone-vibe-coding-app-from-app-store-2000740084
CERN levels up with new superconducting karts,https://home.cern/news/news/engineering/cern-levels-new-superconducting-karts
Axios compromised on NPM – Malicious versions drop remote access trojan,https://www.stepsecurity.io/blog/axios-compromised-on-npm-malicious-versions-drop-remote-access-trojan
An Introduction to Writing Systems and Unicode,https://r12a.github.io/scripts/tutorial/part2
Delve – Fake Compliance as a Service – Part II – Day 2 of 5,https://deepdelver.substack.com/p/delve-fake-compliance-as-a-service-98a
Apple at 50,https://www.apple.com/
Will AI Eventually Thrive Outside the Moat?,https://www.unite.ai/will-ai-eventually-thrive-outside-the-moat/
Montana referendum to outlaw corporate campaign contributions [video],https://www.youtube.com/watch?v=p1fPbGHe3xE
Default GraphQL response is now HTTP 500,https://graphql.org/blog/2026-04-01-a-new-era-for-graphql-observability/
Bring Back MiniDV with This Raspberry Pi FireWire Hat,https://www.jeffgeerling.com/blog/2026/minidv-with-raspberry-pi-firewire-hat/
Claude wrote a full FreeBSD remote kernel RCE with root shell,https://github.com/califio/publications/blob/main/MADBugs/CVE-2026-4747/write-up.md
Randomness on Apple Platforms (2024),https://blog.xoria.org/randomness-on-apple-platforms/
OpenAI closes funding round at an $852B valuation,https://www.cnbc.com/2026/03/31/openai-funding-round-ipo.html
Ukrainian drone holds position for 6 weeks,https://defenceleaders.com/news/ukrainian-combat-robot-holds-frontline-position-for-six-weeks-in-sign-of-growing-ugv-maturity/
The AI Marketing BS Index,https://bastian.rieck.me/blog/2026/bs/
Why Iran targeted Amazon data centers,https://theconversation.com/why-iran-targeted-amazon-data-centers-and-what-that-does-and-doesnt-change-about-warfare-278642
Show HN: Real-time dashboard for Claude Code agent teams,https://github.com/simple10/agents-observe
The Document Foundation ejects its core developers,https://www.collaboraonline.com/blog/tdf-ejects-its-core-developers/
Google Cloud: Investing in the Future of PostgreSQL,https://opensource.googleblog.com/2026/03/google-cloud-investing-in-the-future-of-postgresql.html
A dot a day keeps the clutter away,https://scottlawsonbc.com/post/dot-system
I quit. The clankers won,https://dbushell.com/2026/04/01/i-quit-the-clankers-won/
From 300KB to 69KB per Token: How LLM Architectures Solve the KV Cache Problem,https://news.future-shock.ai/the-weight-of-remembering/
Teenage Engineering's PO-32 acoustic modem and synth implementation,https://github.com/ericlewis/libpo32
Cohere Transcribe: Speech Recognition,https://cohere.com/blog/transcribe
Rick Dangerous,https://www.simonphipps.com/games/rickdangerous/
Comparing C/C++ unity build with regular build on a large codebase (2024),https://hereket.com/posts/cpp-unity-compile-inkscape/
Ordinary Lab Gloves May Have Skewed Microplastic Data,https://nautil.us/ordinary-lab-gloves-may-have-skewed-microplastic-data-1279386
Wikidata: WikiProject Ontology/Ontology Course,https://www.wikidata.org/wiki/Wikidata:WikiProject_Ontology/Ontology_Course
"""Vibecession"" reflects an increasingly difficult economy and society",https://greyenlightenment.com/2025/12/24/vibecession-reflects-increasingly-difficult-economy/
"AbodeLLM – An offline AI assistant for Android devices, based on open models",https://github.com/brendmung/AbodeLLM
The Finest Swiss Quality Quaternions,https://se3.ch/
Show HN: Postgres extension for BM25 relevance-ranked full-text search,https://github.com/timescale/pg_textsearch
"Dutch armed forces recruiting 1,200 drone specialists",https://nltimes.nl/2026/04/01/dutch-armed-forces-recruiting-1200-drone-specialists-first-reported-duty-today
Neanderthals survived on a knife's edge for 350k years,https://www.science.org/content/article/neanderthals-survived-knife-s-edge-350-000-years
Show HN: 65k AI voters predict UK local elections with 75% accuracy,https://kronaxis.co.uk/blog/predicting-may-7-elections
"Show HN: 1-Bit Bonsai, the First Commercially Viable 1-Bit LLMs",https://prismml.com/
43 hours battery life: Dell XPS 14 2026 lasts almost 3x longer vs MacBook Air 15,https://www.notebookcheck.net/43-hours-battery-life-Dell-XPS-14-2026-lasts-almost-3x-longer-vs-MacBook-Air-15-M5-in-web-browsing-test.1262947.0.html
Back to FreeBSD – Part 2 – Jails,https://hypha.pub/back-to-freebsd-part-2
I traced my traffic through a home Tailscale exit node,https://tech.stonecharioteer.com/posts/2026/tailscale-exit-nodes/
Why the US Navy won't blast the Iranians and 'open' Strait of Hormuz,https://responsiblestatecraft.org/iran-strait-of-hormuz/
"""Special 301"" Comments on Nintendo Game Piracy in Asia and Latin America (1994)",https://archive.gamehistory.org/item/8aa9a6fb-1593-47ce-bdf0-aa79abdcb0e6
Claude Code Unpacked : A visual guide,https://ccunpacked.dev/
Show HN: Forkrun – NUMA-aware shell parallelizer (50×–400× faster than parallel),https://github.com/jkool702/forkrun
Perplexity Says MCP Sucks,https://suthakamal.substack.com/p/perplexity-says-mcp-sucks
