title,url
"Cognichip wants AI to design the chips that power AI, and just raised $60M to try",https://techcrunch.com/2026/04/01/cognichip-wants-ai-to-design-the-chips-that-power-ai-and-just-raised-60m-to-try/
"Salesforce announces an AI-heavy makeover for Slack, with 30 new features",https://techcrunch.com/2026/03/31/salesforce-announces-an-ai-heavy-makeover-for-slack-with-30-new-features/
"OpenAI, not yet public, raises $3B from retail investors in monster $122B fund raise",https://techcrunch.com/2026/03/31/openai-not-yet-public-raises-3b-from-retail-investors-in-monster-122b-fund-raise/
Yupp shuts down after raising $33M from a16z crypto’s Chris Dixon,https://techcrunch.com/2026/03/31/yupp-ai-shuts-down-33m-a16z-crypto-chris-dixon/
Nomadic raises $8.4 million to wrangle the data pouring off autonomous vehicles,https://techcrunch.com/2026/03/31/nomadic-raises-8-4-million-to-wrangle-the-data-pouring-off-avs/
"Exclusive: Runway launches $10M fund, Builders program to support early-stage AI startups",https://techcrunch.com/2026/03/31/exclusive-runway-launches-10m-fund-builders-program-to-support-early-stage-ai-startups/
"With its new app store, Ring bets on AI to go beyond home security",https://techcrunch.com/2026/03/31/ring-app-store-bets-on-ai-to-go-beyond-home-security/
"15% of Americans say they’d be willing to work for an AI boss, according to new poll",https://techcrunch.com/2026/03/30/ai-work-boss-supervisor-us-quinnipiac-poll/
Popular AI gateway startup LiteLLM ditches controversial startup Delve,https://techcrunch.com/2026/03/30/popular-ai-gateway-startup-litellm-ditches-controversial-startup-delve/
"As more Americans adopt AI tools, fewer say they can trust the results",https://techcrunch.com/2026/03/30/ai-trust-adoption-poll-more-americans-adopt-tools-fewer-say-they-can-trust-the-results/
Mantis Biotech is making ‘digital twins’ of humans to help solve medicine’s data availability problem,https://techcrunch.com/2026/03/30/mantis-biotech-is-making-digital-twins-of-humans-to-help-solve-medicines-data-availability-problem/
ScaleOps raises $130M to improve computing efficiency amid AI demand,https://techcrunch.com/2026/03/30/scaleops-130m-series-c-kubernetes-efficiency-ai-demand-funding/
AI chip startup Rebellions raises $400 million at $2.3B valuation in pre-IPO round,https://techcrunch.com/2026/03/30/ai-chip-startup-rebellions-raises-400-million-at-2-3b-valuation-in-pre-ipo-round/
Mistral AI raises $830M in debt to set up a data center near Paris,https://techcrunch.com/2026/03/30/mistral-ai-raises-830m-in-debt-to-set-up-a-data-center-near-paris/
Qodo raises $70M for code verification as AI coding scales,https://techcrunch.com/2026/03/30/qodo-bets-on-code-verification-as-ai-coding-scales-raises-70m/
Starcloud raises $170 million Series A to build data centers in space,https://techcrunch.com/2026/03/30/starcloud-raises-170-million-series-ato-build-data-centers-in-space/
Why OpenAI really shut down Sora,https://techcrunch.com/2026/03/29/why-openai-really-shut-down-sora/
Sora’s shutdown could be a reality check moment for AI video,https://techcrunch.com/2026/03/29/soras-shutdown-could-be-a-reality-check-moment-for-ai-video/
"Bluesky leans into AI with Attie, an app for building custom feeds",https://techcrunch.com/2026/03/28/bluesky-leans-into-ai-with-attie-an-app-for-building-custom-feeds/
Stanford study outlines dangers of asking AI chatbots for personal advice,https://techcrunch.com/2026/03/28/stanford-study-outlines-dangers-of-asking-ai-chatbots-for-personal-advice/
Elon Musk’s last co-founder reportedly leaves xAI,https://techcrunch.com/2026/03/28/elon-musks-last-co-founder-reportedly-leaves-xai/
Why SoftBank’s new $40B loan points to a 2026 OpenAI IPO,https://techcrunch.com/2026/03/27/why-softbanks-new-40b-loan-points-to-a-2026-openai-ipo/
Google is now letting users in the US change their Gmail address,https://techcrunch.com/2026/03/31/google-is-now-letting-users-in-the-us-change-their-gmail-address/
Email obfuscation: What works in 2026?,https://spencermortensen.com/articles/email-obfuscation/
AI for American-produced cement and concrete,https://engineering.fb.com/2026/03/30/data-center-engineering/ai-for-american-produced-cement-and-concrete/
AI Perfected Chess. Humans Made It Unpredictable Again,https://www.bloomberg.com/news/articles/2026-03-27/ai-changed-chess-grandmasters-now-win-with-unpredictable-moves
InspectMind AI (YC W24) Is Hiring,https://www.ycombinator.com/companies/inspectmind-ai/jobs/jQNra64-software-engineer-build-the-world-s-best-ai-plan-checker
StepFun 3.5 Flash is #1 cost-effective model for OpenClaw tasks (300 battles),https://app.uniclaw.ai/arena?tab=costEffectiveness&via=hn
Windows 95 defenses against installers that overwrite a file with an older one,https://devblogs.microsoft.com/oldnewthing/20260324-00/?p=112159
"ZomboCom stolen by a hacker, sold, now replaced with AI-generated makeover",https://old.reddit.com/r/oldinternet/comments/1raiz8v/zombocom_was_stolen_by_hacker_put_up_for_sale_and/
Refine: AI-Powered Peer Review,https://www.refine.ink/
Will AI Eventually Thrive Outside the Moat?,https://www.unite.ai/will-ai-eventually-thrive-outside-the-moat/
Montana referendum to outlaw corporate campaign contributions [video],https://www.youtube.com/watch?v=p1fPbGHe3xE
OpenAI closes funding round at an $852B valuation,https://www.cnbc.com/2026/03/31/openai-funding-round-ipo.html
Ukrainian drone holds position for 6 weeks,https://defenceleaders.com/news/ukrainian-combat-robot-holds-frontline-position-for-six-weeks-in-sign-of-growing-ugv-maturity/
The AI Marketing BS Index,https://bastian.rieck.me/blog/2026/bs/
"AbodeLLM – An offline AI assistant for Android devices, based on open models",https://github.com/brendmung/AbodeLLM
Show HN: 65k AI voters predict UK local elections with 75% accuracy,https://kronaxis.co.uk/blog/predicting-may-7-elections
"Show HN: 1-Bit Bonsai, the First Commercially Viable 1-Bit LLMs",https://prismml.com/
43 hours battery life: Dell XPS 14 2026 lasts almost 3x longer vs MacBook Air 15,https://www.notebookcheck.net/43-hours-battery-life-Dell-XPS-14-2026-lasts-almost-3x-longer-vs-MacBook-Air-15-M5-in-web-browsing-test.1262947.0.html
Back to FreeBSD – Part 2 – Jails,https://hypha.pub/back-to-freebsd-part-2
I traced my traffic through a home Tailscale exit node,https://tech.stonecharioteer.com/posts/2026/tailscale-exit-nodes/
Why the US Navy won't blast the Iranians and 'open' Strait of Hormuz,https://responsiblestatecraft.org/iran-strait-of-hormuz/
