title,url
Picsart now allows creators to ‘hire’ AI assistants through agent marketplace,https://techcrunch.com/2026/03/16/picsart-now-allows-creators-to-hire-ai-assistants-through-agent-marketplace/
Nvidia’s version of OpenClaw could solve its biggest problem: security,https://techcrunch.com/2026/03/16/nvidias-version-of-openclaw-could-solve-its-biggest-problem-security/
Jensen Huang just put Nvidia’s Blackwell and Vera Rubin sales projections into the $1 trillion stratosphere,https://techcrunch.com/2026/03/16/jensen-just-put-nvidias-blackwell-and-vera-rubin-sales-projections-into-the-1-trillion-stratosphere/
Warren presses Pentagon over decision to grant xAI access to classified networks,https://techcrunch.com/2026/03/16/warren-presses-pentagon-over-decision-to-grant-xai-access-to-classified-networks/
Memories AI is building the visual memory layer for wearables and robotics,https://techcrunch.com/2026/03/16/memories-ai-is-building-the-visual-memory-layer-for-wearables-and-robotics/
Elon Musk’s xAI faces child porn lawsuit from minors Grok allegedly undressed,https://techcrunch.com/2026/03/16/elon-musks-xai-faces-child-porn-lawsuit-from-minors-grok-allegedly-undressed/
"Nvidia’s DLSS 5 uses generative AI to boost photorealism in video games, with ambitions beyond gaming",https://techcrunch.com/2026/03/16/nvidias-dlss-5-uses-generative-ai-to-boost-photo-realism-in-video-games-with-ambitions-beyond-gaming/
How to watch Jensen Huang’s Nvidia GTC 2026 keynote — and what to expect,https://techcrunch.com/2026/03/16/nvidia-gtc-how-to-watch-jensen-huang-2026-keynote/
Another deep tech chip startup becomes a unicorn: Frore hits $1.64B,https://techcrunch.com/2026/03/16/another-deep-tech-chip-startup-becomes-a-unicorn-frore-hits-1-64b/
Fuse raises $25M  to disrupt aging loan origination systems used by US credit unions,https://techcrunch.com/2026/03/16/fuse-raises-25m-to-disrupt-aging-loan-origination-systems-used-by-u-s-credit-unions/
The dictionary sues OpenAI,https://techcrunch.com/2026/03/16/merriam-webster-openai-encyclopedia-brittanica-lawsuit/
"Google, Accel India accelerator chooses 5 startups and none are ‘AI wrappers’",https://techcrunch.com/2026/03/15/google-and-accel-cut-through-wrappers-in-4000-ai-startup-pitches-to-pick-five-tied-to-india/
ByteDance reportedly pauses global launch of its Seedance 2.0 video generator,https://techcrunch.com/2026/03/15/bytedance-reportedly-pauses-global-launch-of-its-seedance-2-0-video-generator/
Lawyer behind AI psychosis cases warns of mass casualty risks,https://techcrunch.com/2026/03/15/lawyer-behind-ai-psychosis-cases-warns-of-mass-casualty-risks/
Wiz investor unpacks Google’s $32B acquisition,https://techcrunch.com/2026/03/15/wiz-investor-unpacks-googles-32b-acquisition/
US Army announces contract with Anduril worth up to $20B,https://techcrunch.com/2026/03/14/us-army-announces-contract-with-anduril-worth-up-to-20b/
Meta reportedly considering layoffs that could affect 20% of the company,https://techcrunch.com/2026/03/14/meta-reportedly-considering-layoffs-that-could-affect-20-of-the-company/
"How to use the new ChatGPT app integrations, including DoorDash, Spotify, Uber, and others",https://techcrunch.com/2026/03/14/how-to-use-the-new-chatgpt-app-integrations-including-doordash-spotify-uber-and-others/
"‘Not built right the first time’ — Musk’s xAI is starting over again, again",https://techcrunch.com/2026/03/13/not-built-right-the-first-time-musks-xai-is-starting-over-again-again/
"Nyne, founded by a father-son duo, gives AI agents the human context they’re missing",https://techcrunch.com/2026/03/13/nyne-founded-by-a-father-son-duo-gives-ai-agents-the-human-context-theyre-missing/
Steven Spielberg says he’s ‘never used AI’ in any of his films,https://techcrunch.com/2026/03/13/steven-spielberg-says-hes-never-used-ai-in-any-of-his-films/
The biggest AI stories of the year (so far),https://techcrunch.com/2026/03/13/the-biggest-ai-stories-of-the-year-so-far/
The wild six weeks for NanoClaw’s creator that led to a deal with Docker,https://techcrunch.com/2026/03/13/the-wild-six-weeks-for-nanoclaws-creator-that-led-to-a-deal-with-docker/
Spotify will let you edit your Taste Profile to control your recommendations,https://techcrunch.com/2026/03/13/spotify-will-let-you-edit-your-taste-profile-to-control-your-recommendations/
"Peacock expands into AI-driven video, mobile-first live sports, and gaming",https://techcrunch.com/2026/03/13/peacock-expands-into-ai-driven-video-mobile-first-live-sports-and-gaming/
"Before quantum computing arrives, this startup wants enterprises already running on it",https://techcrunch.com/2026/03/12/before-quantum-computing-arrives-this-startup-wants-enterprises-already-running-on-it/
Truecaller now lets you hang up on scammers — on behalf of your family,https://techcrunch.com/2026/03/12/truecallers-now-lets-you-hang-up-on-scammers-on-behalf-of-your-family/
"Sales automation startup Rox AI hits $1.2B valuation, sources say",https://techcrunch.com/2026/03/12/sales-automation-startup-rox-ai-hits-1-2b-valuation-sources-say/
Facebook Marketplace now lets Meta AI respond to buyers’ messages,https://techcrunch.com/2026/03/12/facebook-marketplace-now-lets-meta-ai-respond-to-buyers-messages/
Apple quietly launches AirPods Max 2,https://techcrunch.com/2026/03/16/apple-quietly-launches-airpods-max-2/
The billionaires made a promise — now some want out,https://techcrunch.com/2026/03/15/the-billionaires-made-a-promise-now-some-want-out/
US Army announces contract with Anduril worth up to $20B,https://techcrunch.com/2026/03/14/us-army-announces-contract-with-anduril-worth-up-to-20b/
Honda is killing its EVs — and any chance of competing in the future,https://techcrunch.com/2026/03/14/honda-is-killing-its-evs-and-any-chance-of-competing-in-the-future/
Meta reportedly considering layoffs that could affect 20% of the company,https://techcrunch.com/2026/03/14/meta-reportedly-considering-layoffs-that-could-affect-20-of-the-company/
"‘Not built right the first time’ — Musk’s xAI is starting over again, again",https://techcrunch.com/2026/03/13/not-built-right-the-first-time-musks-xai-is-starting-over-again-again/
"Lovable says it added $100M in revenue last month alone, with just 146 employees",https://techcrunch.com/2026/03/11/lovable-says-it-added-100m-in-revenue-last-month-alone-with-just-146-employees/
Quince,https://techcrunch.com/2026/03/11/quince-series-e-10b-valuation-with-500m-round-led-by-iconiq/
Lovable,https://techcrunch.com/2026/03/11/lovable-says-it-added-100m-in-revenue-last-month-alone-with-just-146-employees/
Cluely,https://techcrunch.com/2026/03/05/cluely-ceo-roy-lee-admits-to-publicly-lying-about-revenue-numbers-last-year/
WordPress,https://techcrunch.com/2026/03/11/wordpress-debuts-a-private-workspace-that-runs-in-your-browser-via-a-new-service-my-wordpress-net/
Replit,https://techcrunch.com/2026/03/11/replit-snags-9b-valuation-6-months-after-hitting-3b/
Tech Layoffs,https://techcrunch.com/2025/02/28/tech-layoffs-2024-list/
ChatGPT,https://techcrunch.com/2025/01/28/chatgpt-everything-to-know-about-the-ai-chatbot/
